ACCESSION_NUMBER	ISAMENDMENT	PROGRESSUPDATE	NATUREOFAMENDMENT	NAMEOFISSUER	LEGALSTATUSFORM	LEGALSTATUSOTHERDESC	JURISDICTIONORGANIZATION	DATEINCORPORATION	STREET1	STREET2	CITY	STATEORCOUNTRY	ZIPCODE	ISSUERWEBSITE	COMPANYNAME	ISCOISSUER	COMMISSIONCIK	COMMISSIONFILENUMBER	CRDNUMBER
0001574863-21-000002	0			Drone Guarder, Inc.	Corporation		NV	2012-05-04	370 Amapola Ave	Unit 200A	Torrance	CA	90501	www.droneguarderinc.com	truCrowd, Inc	N	0001667145	007-00015	283063
0001878418-21-000005	0		Replacing &quot;Barterr&quot; with &quot;Barterr Inc.&quot;.	Barterr Inc.	Corporation		DE	2021-05-17	101 N Brand Blvd		Glendale	CA	91203	https://www.sole360.com/	Seed At The Table	N	0001808131	007-00230	005548762
0001665160-21-001484	0	Issuer closed on $315,911.34 and 417,895 shares.		Naboso Technology, Inc.	Corporation		DE	2016-10-24	6825 W GALVESTON STREET SUITE 9	SUITE 9	CHANDLER	AZ	85226	https://www.naboso.com/	StartEngine Capital, LLC	N	0001665160	007-00007	
0001670254-21-000938	0	The final number is $61,421.00 in investments.		HEREYOUGO TECHNOLOGIES INC.	Corporation		DE	2018-09-11	44 E. 3RD		SAN MATEO	CA	94401	http://hereyougo.io	Wefunder Portal LLC	N	0001670254	007-00033	283503
0001802405-21-000006	0			Curastory Inc.	Corporation		DE	2019-08-23	284 HUMBOLDT ST	#5E	BROOKLYN	NY	11206	www.curastory.co	OpenDeal Portal LLC	N	0001751525	007-00167	283874
0001746059-21-000408	0			Marinas Cafe, LLC	Limited Liability Company		IL	2021-01-28	3517 N SPAULDING AVE		CHICAGO	IL	60618	marinascafechicago.com	MainVest, Inc.	N	0001746059	007-00162	
0001670254-21-000936	0			Gamestar Interactive, Inc	Corporation		DE	2019-04-29	12100 Wilshire Blvd	Ste 1540	Los Angeles	CA	90025	http://www.gamestarplus.com	Wefunder Portal LLC	Y	0001670254	007-00033	283503
0001670254-21-000935	1		C/A - clarifying current traction & claims made in initial offering materials	Bamboo Ecologic Corp	Corporation		NV	2013-01-09	9030 58th Drive East #102		Lakewood Ranch	FL	34202	http://rizomeco.com/	Wefunder Portal LLC	N	0001670254	007-00033	283503
0001878162-21-000002	0			We ChipN, Inc.	Corporation		DE	2021-05-10	131 Prairie Lane		Alexandria	VA	22314	www.wechipn.com	Seed At The Table	N	0001808131	007-00230	005548762
0001821120-21-000001	0			Temple I, LLC	Limited Liability Company		PA	2020-06-26	85 BROAD STREET		NEW YORK	NY	10004	nyeg.co		N			
0001877762-21-000002	0			Alchemy Springs Partners, LLC	Limited Liability Company		DE	2021-08-03	2407 HARRISON ST	#13	SAN FRANCISCO	CA	94110	www.alchemysprings.com	NSSC Funding Portal, LLC	N	0001665614	007-00012	
0001746059-21-000407	0			Zaahh, Inc.	Corporation		CA	2018-10-11	401 ASH STREET #3		MILL VALLEY	CA	94941	https://awesomesourdough.com/	MainVest, Inc.	N	0001746059	007-00162	
0001669191-21-000815	0		the issuer extended the offering date.	Kazoo LLC	Limited Liability Company		DC	2019-04-01	3034 Dent Place NW		Washington	DC	20007	https://kazoo.ai	NetCapital Funding Portal Inc.	N	0001669191	007-00035	283596
0001670254-21-000933	0			Petri Bio Inc.	Corporation		DE	2020-08-28	370 Amapola Ave	suite 100	Torrance	CA	90501	https://petribio.com/		N			
0001746059-21-000406	0			Pure Grind Fitness, LLC	Limited Liability Company		NC	2020-08-11	938 OLD FORESTER LN		CHARLOTTE	NC	28214	https://www.puregrindfit.com/	MainVest, Inc.	N	0001746059	007-00162	
0001670254-21-000930	0			Voi, Inc.	Corporation		DE	2013-01-24	60 Park Street		Springfield	VT	05156	https://www.voi.health	Wefunder Portal LLC	Y	0001670254	007-00033	283503
0001670254-21-000928	0			King Equity Group Inc.	Corporation		FL	2020-09-03	7901 4th St N, STE 300		St Petersburg	FL	33702	https://www.worlddatascience.tech/	Wefunder Portal LLC	Y	0001670254	007-00033	283503
0001811482-21-000012	0			Lunchwale,Inc.	Corporation		TX	2017-12-18	10601 CLARENCE DR,	STE 250	FRISCO	TX	75033	lunchwale.co		N			
0001665160-21-001483	0	At the close of the offering, the Issuer closed on $342,909.83 and 553,423 number of securities.		Taste Labs, Inc	Corporation		DE	2018-01-08	833 BROADWAY, FLOOR 2	2ND FLOOR	NEW YORK	NY	10003	https://www.taste.io/	StartEngine Capital, LLC	N	0001665160	007-00007	
0001862793-21-000002	0	The issuer raised approximately $715,850.25 during the offering period. Payments are still being processed; the exact amount has yet to be determined.		Modal Living, Inc.	Corporation		DE	2019-01-23	132 S. STATE ST.		SALT LAKE CITY	UT	84111	https://livemodal.com/	SI SECURITIES, LLC	N	0001603038	008-69440	000170937
0001670254-21-000926	0			LifeBridge 10000, LLC	Limited Liability Company		FL	2015-01-05	862 East Wildmere Avenue		LONGWOOD	FL	32750	http://www.lifebridge10000.com/	Wefunder Portal LLC	Y	0001670254	007-00033	283503
0001670254-21-000925	1		Added a lead investor	Persistence Data Mining, Inc.	Corporation		NV	2012-02-23	9404 Genesee Ave., Ste. 340		La Jolla	CA	92037	http://www.persistencedatamining.com	Wefunder Portal LLC	N	0001670254	007-00033	283503
0001665160-21-001482	0	Parknav (AI Incube, Inc.) closed on $801,874 of convertible promissory notes.		Ai Incube, Inc.	Corporation		DE	2009-07-14	315 MONTGOMERY ST, 9TH FL.	9TH FL.	SAN FRANCISCO	CA	94104	http://parknav.com/	Wefunder Portal LLC	N	0001670254	007-00033	283503
0001644600-21-000082	0	The previous CF offering closed on April 8, 2021, and sold 618,041 shares of Class A Preferred Units at a price of $1 per Unit or $618,041.		VIROMENT EQUITY LLC	Limited Liability Company		DE	2020-10-30	33 SOUTH 6TH STREET	SUITE 4750	MINNEAPOLIS	MN	55402	http://Viroment.com	Wefunder Portal LLC	N	0001670254	007-00033	283503
0001811482-21-000010	0			Lunchwale,Inc.	Corporation		TX	2017-12-18	10601 CLARENCE DR,	STE 250	FRISCO	TX	75033	lunchwale.co		N			
0001644600-21-000079	0			VIROMENT EQUITY LLC	Limited Liability Company		DE	2020-10-30	33 SOUTH 6TH STREET	SUITE 4750	MINNEAPOLIS	MN	55402	http://Viroment.com	Wefunder Portal LLC	N	0001670254	007-00033	283503
0001665160-21-001481	0	Issuer closed on 519,965 shares and raised $777,967.84		6d bytes inc.	Corporation		DE	2015-11-16	440 N WOLFE RD M/S 215	M/S 215	SUNNYVALE	CA	94085	https://www.blendid.com/	StartEngine Capital, LLC	N	0001665160	007-00007	
0001669191-21-000813	0		the issuer extended the offering date.	Hercules Electric Mobility, Inc	Corporation		MI	2018-12-26	2785 E Grand Blvd		Detroit	MI	48221	https://herculesev.com/	NetCapital Funding Portal Inc.	N	0001669191	007-00035	283596
0001665160-21-001480	1		Issuer is extending their campaign for 90 days.	O2 Treehouse Commercial, Inc	Corporation		CA	2019-03-06	1960 MANDELA PARKWAY	APT 15	OAKLAND	CA	94501	https://www.o2treehouse.com/	StartEngine Capital LLC	N	0001665160	007-00007	
0001875432-21-000001	0			Simple Bread Co LLC	Limited Liability Company		GA	2018-11-28	2636 Arldowne Dr.		TUCKER	GA	30084	simplebreadcompany.com	Honeycomb Portal LLC	N	0001705726	007-00119	289015
0001665160-21-001479	0		Clerical error with minimum investment amount.	Aquipor Technologies, Inc.	Corporation		WA	2015-10-21	4118 E. 33rd Ave.		Spokane	WA	99223	https://aquipor.com/	StartEngine Capital, LLC	N	0001665160	007-00007	
0001665160-21-001477	0			GIFTWITH Inc															
0001619078-21-000010	0	The Offering closed successfully on 8/14/2021, having received investment commitments of $979,175.07, although a final accounting has not taken place.		Maybe Finance, Inc.	Corporation		DE	2021-03-17	1900 CORPORATE DR #380024		BIRMINGHAM	AL	35238	https://maybe.co	OpenDeal Portal LLC	N	0001751525	007-00167	283874
0001619078-21-000009	0	The Offering closed successfully on 8/15/2021, having received investment commitments of $4,850,616.50, although a final accounting has not taken place.		Peaberry Software Inc.	Corporation		DE	2012-01-30	921 SW WASHINGTON ST	SUITE 820	PORTLAND	OR	97205	https://www.customer.io	OpenDeal Portal LLC	N	0001751525	007-00167	283874
0001828473-21-000002	1		This Form C/A amends the Form C filed on April 8, 2021, by extending the offering deadline from August 20, 2021 to January 31, 2022. Additionally, this Form C/A updates the outstanding debt and cash on hand of the Company.	Upright Oats LLC	Limited Liability Company		CT	2019-04-02	1204 MAIN STREET	SUITE 552	BRANFORD	CT	06405	https://www.uprightoats.com/	OpenDeal Portal LLC	N	0001751525	007-00167	283874
0001683168-21-003616	0		The expiration of the Offering Deadline has been extended to November 23, 2021 and the Dated Date and Maturity Date of the unissued Notes have been extended to November 23, 2022.	Hemp CR Inc	Corporation		NV	2020-06-23	500 N RAINBOW STE 300		LAS VEGAS	NV	89107	www.hemper.com	crowdsourcefunded.com	N	0001667727	007-00027	283378
0001665160-21-001476	1		Issuer updated their page to reflect the change in offering maximum.	AtomBeam Technologies Inc.	Corporation		DE	2017-08-17	1036 Country Club Dr, Suite 200		Moraga	CA	94556	https://atombeamtech.com/	StartEngine Capital, LLC	N	0001665160	007-00007	
0001670254-21-000923	0			Xenolith Vault, LLC	Limited Liability Company		AZ	2009-02-24	2600 W Germann Rd		Chandler	AZ	85286	https://xenolith.io	Wefunder Portal LLC	Y	0001670254	007-00033	283503
0001665160-21-001472	0			K-9 Power Products, Inc.	Corporation		DE	2021-06-10	100 S Ashley Drive, Suite 1130		Tampa	FL	33602	https://www.k9power.com/	StartEngine Capital, LLC	N	0001665160	007-00007	
0001665160-21-001471	0		Issuer is updating director information and campaign page	Better Family, Inc	Corporation		DE	2010-06-15	11150 North Williams St, #8-109		Dunnellon	FL	34432	https://www.thebeebo.com/pages/better-family-inc	StartEngine Capital, LLC	N	0001665160	007-00007	
0001665160-21-001469	0	At the close of the offering, the issuer closed on $292,716.00 and 317,961 shares of Class A.		Janover Inc.	Corporation		DE	2018-11-28	7601 N FEDERAL HWY, B-140	SUITE B-140	BOCA RATON	FL	33487	https://www.janover.ventures/	StartEngine Capital, LLC	N	0001665160	007-00007	
0001665160-21-001468	0		"Issuer updated the ""meet the team"" section of their campaign page"	Enginuity Power Systems, Inc.	Corporation		DE	2015-11-07	730 S Washington Street		Alexandria	VA	22314	https://enginuitypowersystems.com/	StartEngine Capital, LLC	N	0001665160	007-00007	
0001665160-21-001466	0		Issuer is shortening the campaign end date by 57 days.	Sustainable Imprints, Inc.	Corporation		IL	2018-11-07	1385 GREEN BAY ROAD		HIGHLAND PARK	IL	60035	http://www.sicontainerbuilds.com	StartEngine Capital, LLC	N	0001665160	007-00007	
0001878418-21-000002	0			Barterr	Corporation		CA	2021-05-17	101 N Brand Blvd		Glendale	CA	91203	https://www.sole360.com/	Seed At The Table	N	0001808131	007-00230	005548762
0001665160-21-001465	0		Updated valuation and amount of shares outstanding	Love Sun Body, Inc.	Corporation		DE	2021-05-18	50 Cummings Circle		West Orange	NJ	07052	https://lovesunbody.com/	StartEngine Capital, LLC	N	0001665160	007-00007	
0001876456-21-000001	0			Nett Venture Investments LLC	Limited Liability Company		TX	2019-09-20	1717 W 22nd Street		HOUSTON	TX	77008	www.nettbarhouston.com	NEXTSEED SECURITIES, LLC	N	0001723503	008-70055	000291387
0001746059-21-000405	1		Issuer is amending the maturity date of the note agreement.	Sol Hospitality Group, LLC	Limited Liability Company		FL	2021-07-01	2149 3RD AVE S # 6		ST PETERSBURG	FL	33712	http://www.solstpete.com	MainVest, Inc.	N	0001746059	007-00162	
0001669191-21-000810	1		the issuer extended the offering date and updated the other material information section.	EDSO Inc.	Corporation		DE	2017-04-04	9595 Rombauer Road	Unit 105	Coppell	TX	75019	https://educatedsocially.com	NetCapital Funding Portal Inc.	N	0001669191	007-00035	283596
0001665160-21-001464	0		Correction in the max raise amount in the offering memo only	Ubihere, Inc.	Corporation		OH	2016-10-17	4621 Lyman Drive		Hilliard	OH	43026	https://ubihere.com/	StartEngine Capital, LLC	N	0001665160	007-00007	
0001665160-21-001463	0			Orion Haus Homes & Hotels Inc.	Corporation		DE	2021-07-15	2801 S. Federal Highway, 21770		Fort Lauderdale	FL	33335	www.orionhaus.com	StartEngine Capital, LLC	N	0001665160	007-00007	
0001853183-21-000003	0		Amending the offering deadline	QwikLeaf, Inc.	Corporation		NV	2020-02-27	77570 SPRINGFIELD LN. STE. J		PALM DESERT	CA	92211	https://www.qwikleaf.com/	truCrowd, Inc	N	0001667145	007-00015	283063
0001670254-21-000922	1		Added 2019 and 2020 audited financials; increased the max fundraise amount to $3M	Boaz Bikes inc	Corporation		DE	2021-02-03	7600 Chrysler dr.	Unit 101	Detroit	MI	48211	http://www.boazbikes.com	Wefunder Portal LLC	N	0001670254	007-00033	283503
0001746059-21-000404	0			TACO PORT, LLC															
0001665160-21-001461	0			T4L INC.	Corporation		DE	2020-08-25	8267 PARKSTONE PL 108		Naples	FL	34120	https://www.t4l.me/	StartEngine Capital, LLC	N	0001665160	007-00007	
0001669191-21-000808	0		the issuer changed the closing date.	Energy Exploration Technologies, Inc.	Corporation		PR	2018-12-18	65 Green Villa Dr.	#21	Dorado	PR	00646	www.energyx.com	NetCapital Funding Portal Inc.	N	0001669191	007-00035	283596
0001683168-21-003511	0		The expiration of the Offering Deadline has been extended to August 23, 2021 and the Dated Date and Maturity Date of the unissued Notes have been extended to August 23, 2022.	Hemp CR Inc	Corporation		NV	2020-06-23	500 N RAINBOW STE 300		LAS VEGAS	NV	89107	www.hemper.com	crowdsourcefunded.com	N	0001667727	007-00027	283378
0001670254-21-000918	0			Powur, PBC	Other	Public Benefit Corporation	DE	2014-01-02	5850 El Camino Real		Carlsbad	CA	92009	http://www.powur.com	Wefunder Portal LLC	Y	0001670254	007-00033	283503
0001844448-21-000009	0	The issuer's offering resulted in a total of $123,200.		HealthTech Solutions Inc	Corporation		KY	2016-02-17	348 E MAIN STREET		LEXINGTON	KY	40507	https://www.getomnilife.com	Wunderfund, Inc.	N	0001707360	007-00116	
0001665160-21-001457	0			IZO Spirits, Inc.	Corporation		DE	2020-12-21	5404 Napa Street, Suite 300		San Diego	CA	92103	www.izospirits.com	StartEngine Capital, LLC	N	0001665160	007-00007	
0001670254-21-000916	0			BioMedican, Inc	Corporation		DE	2017-10-10	40471 Encyclopedia Cir		Fremont	CA	94538	https://biomedican.com	Wefunder Portal LLC	Y	0001670254	007-00033	283503
0001670254-21-000920	0			World Tree USA, LLC	Limited Liability Company		NV	2015-06-03	2361 Rosecrans Ave., Suite 475		El Segundo	CA	90245	http://www.worldtree.eco	Wefunder Portal LLC	N	0001670254	007-00033	283503
0001670254-21-000914	0			PersonaFi, Inc.	Corporation		DE	2021-02-16	1722 W Jeanine Dr		Tempe	AZ	85284	http://personafi.co	Wefunder Portal LLC	Y	0001670254	007-00033	283503
0001824158-21-000002	0			NatureTrak, Inc.	Corporation		CA	2019-12-31	2010-A HARBISON DRIVE SUITE 507		VACAVILLE	CA	95687	https://naturetrak.com	OpenDeal Portal LLC	N	0001751525	007-00167	283874
0001670254-21-000912	0			Sativa Building Systems LLC	Limited Liability Company		WI	2018-11-29	N6416 Banner Rd		Wittenberg	WI	54499	https://www.sativabuildingsystems.com/	Wefunder Portal LLC	Y	0001670254	007-00033	283503
0001690433-21-000008	1		This Form C Amendment is being filed to include audited financial statements, increase the Maximum Offering Amount, update the issuer's form, update the share price, update the deadline, and include information about a bridge loan.	AFFL ASSOCIATES, LLC	Corporation		DE	2016-10-19	1350 AVENUE OF THE AMERICAS	SUITE 2010	NEW YORK	NY	10019	https://www.affl.com	SI SECURITIES, LLC	N	0001603038	008-69440	000170937
0001849940-21-000002	0			Make Real Foods, Inc.															
0001875649-21-000001	0			Lakrisha Davis & Co	Corporation		IL	2018-01-18	1765 EAST 55TH STREET	#D6	CHICAGO	IL	60615	www.lakrishadavis.com	SMBX, Inc.	N	0001707214	007-00129	290186
0001665160-21-001453	0			T4L INC.	Corporation		DE	2020-08-25	8267 PARKSTONE PL 108		Naples	FL	34120	https://www.t4l.me/		N			
0001746059-21-000403	0			Sol Hospitality Group, LLC	Limited Liability Company		FL	2021-07-01	2149 3RD AVE S # 6		ST PETERSBURG	FL	33712	http://www.solstpete.com	MainVest, Inc.	N	0001746059	007-00162	
0001670254-21-000911	0		CA - adjusting past raises typo	CabinetM Inc.	Corporation		DE	2014-06-25	115 Oxbow Road		Framingham	MA	01701	http://www.cabinetm.com	Wefunder Portal LLC	Y	0001670254	007-00033	283503
0001174199-21-000005	1		(i) modify Directors, Officers and Managers table, and information herein regarding executive offices and directors, to reflect the resignation of two executive officers and directors of the Company, and (ii) extend Offering Deadline to August 31, 2021	FT1 Inc.	Corporation		NY	2019-07-24	2009 DECKER AVE		MERRICK	NY	11566	https://fundthefirst.com/	OpenDeal Portal LLC	N	0001751525	007-00167	283874
0001644600-21-000076	0			Legion M Entertainment, Inc.	Corporation		DE	2016-03-04	1801 CENTURY PARK EAST 24TH FLOOR		LOS ANGELES	CA	90067	www.legionm.com		N			
0001665160-21-001451	1		Issuer is adding 2 acquisitions, updating board members, changing company name, extending campaign end date, updating campaign page	Better Family, Inc	Corporation		DE	2010-06-15	11150 North Williams St, #8-109		Dunnellon	FL	34432	https://www.thebeebo.com/pages/better-family-inc	StartEngine Capital, LLC	N	0001665160	007-00007	
0001174199-21-000004	0			KONING CORP	Corporation		DE	2002-01-14	5555 OAKBROOK PARKWAY	SUITE 640	NORCROSS	GA	30093	https://www.koninghealth.com	OpenDeal Portal LLC	N	0001751525	007-00167	283874
0001665160-21-001449	0			MovoCash, Inc.															
0001867448-21-000003	0		The amendment is to fix a typographical error in the Discount rate mentioned on the first page of the CrowdSAFE. The revision changes the discount rate to 20%.	Emrod Inc.	Corporation		DE	2021-04-27	40 KENWYN STREET, PARNELL	SUITE C	AUCKLAND	Q2	1052	https://www.emrod.energy	OpenDeal Portal LLC	N	0001751525	007-00167	283874
0001665160-21-001445	1		The issuer updated their perks for the offering.	GACW Incorporated	Corporation		AZ	2019-11-26	3110 West Ray Road, Suite 201		Chandler	AZ	85226	https://globalaircylinderwheels.com/	StartEngine Capital, LLC	N	0001665160	007-00007	
0001746059-21-000402	0	At the close of the offering, the issuer closed on $16,800. The funds are currently being processed. The actual amount may be lower.		Tasty Acres Homestead, LLC	Limited Liability Company		ID	2021-05-06	7062 ASH ST		BONNERS FERRY	ID	83805	https://www.facebook.com/pg/sewardAKfarm/posts/	MainVest, Inc.	N	0001746059	007-00162	
0001746059-21-000401	0	At the close of the offering, the issuer closed on $37,100. The funds are currently being processed. The actual amount may be lower.		Glow Worm Play Cafe, LLC	Limited Liability Company		KY	2021-04-09	962 BARRET AVE		LOUISVILLE	KY	40204	https://facebook.com/glowwormplaycafe	MainVest, Inc.	N	0001746059	007-00162	
0001746059-21-000400	0	At the close of the offering, the issuer closed on $156,300. The funds are currently being processed. The actual amount may be lower.		Moxi On The Rocks LLC	Limited Liability Company		CT	2020-11-02	70 N BEACON ST		HARTFORD	CT	06105	https://www.facebook.com/moxiontherocks/	MainVest, Inc.	N	0001746059	007-00162	
0001746059-21-000399	1		Issuer is amending investment multiple.	Tilton Brothers Brewing, LLC	Limited Liability Company		NH	2017-10-10	845 LAFAYETTE RD STE 6		HAMPTON	NH	03842	http://tiltonbrothersbrewing.com	MainVest, Inc.	N	0001746059	007-00162	
0001665160-21-001442	0	At the close of the offering, the issuer closed on $514,708.6 and 490,751 securities.		MF Fire, Inc.	Corporation		DE	2014-04-23	3031 WASHINGTON BLVD, G		BALTIMORE	MD	21230	mffire.com	StartEngine Capital, LLC	N	0001665160	007-00007	
0001669191-21-000804	0		issuer made changes to the team section on the offering page.	Aerospace Flight Technologies, LLC	Limited Liability Company		DE	2019-08-14	1101 30th St NW	Suite 500	Washington	DC	20007	https://0-glaunch.com	NetCapital Funding Portal Inc.	N	0001669191	007-00035	283596
0001669191-21-000802	0		the issuer extended the offering date.	HOPP Technologies, Inc.	Corporation		CA	2019-05-23	2112 Mountain Ave		Santa Barbara	CA	93101	www.hoppcarpool.com	NetCapital Funding Portal Inc.	N	0001669191	007-00035	283596
0001746059-21-000398	0			Tilton Brothers Brewing, LLC	Limited Liability Company		NH	2017-10-10	845 LAFAYETTE RD STE 6		HAMPTON	NH	03842	http://tiltonbrothersbrewing.com	MainVest, Inc.	N	0001746059	007-00162	
0001665160-21-001440	0			GACW Incorporated	Corporation		AZ	2019-11-26	3110 West Ray Road, Suite 201		Chandler	AZ	85226	https://globalaircylinderwheels.com/	StartEngine Capital, LLC	N	0001665160	007-00007	
0001665160-21-001438	0			Aquipor Technologies, Inc.	Corporation		WA	2015-10-21	4118 E. 33rd Ave.		Spokane	WA	99223	https://aquipor.com/	StartEngine Capital, LLC	N	0001665160	007-00007	
0001665160-21-001436	0			Tapville Franchising Inc.	Corporation		DE	2020-06-08	216 S. Washington Street		Naperville	IL	60540	https://www.tapville.co	StartEngine Capital, LLC	N	0001665160	007-00007	
0001670254-21-000909	0			Phoenix Palm Productions LLC	Limited Liability Company		AZ	2021-05-13	1052 West 4th place		Mesa	AZ	85201	http://www.phoenixpalmproductions.com	Wefunder Portal LLC	Y	0001670254	007-00033	283503
0001867448-21-000001	0			Emrod Inc.	Corporation		DE	2021-04-27	40 Kenwyn Street, Parnell		Auckland	Q2	1052	https://www.emrod.energy	OpenDeal Portal LLC	N	0001751525	007-00167	283874
0001670254-21-000907	0			Fabalish, Inc.	Corporation		DE	2018-03-29	186 Maple Ave		Wallington	NJ	07057	https://www.fabalish.com	Wefunder Portal LLC	Y	0001670254	007-00033	283503
0001665160-21-001434	0	Issuer canceled their campaign with StartEngine		Studio Kitchen Co	Corporation		DE	2021-01-01	6130 W FLAMINGO RD		LAS VEGAS	NV	89103	https://www.thestudio.kitchen/	StartEngine Capital, LLC	N	0001665160	007-00007	
0001805743-21-000003	0			Goodwolf Feeding Co	Corporation		OR	2016-10-11	7715 NE 33RD DRIVE SUITE D		PORTLAND	OR	97211	www.drinkgoodwolf.com	MICROVENTURE MARKETPLACE INC.	N	0001478147	008-68458	000152513
0001665160-21-001433	0		Issuer updated information regarding an officer.	Hexanika, Inc.	Corporation		DE	2014-01-31	419 Main St Suite 200 North		Little Rock	AR	72114	https://hexanika.com/	StartEngine Capital, LLC	N	0001665160	007-00007	
0001665160-21-001431	0	Issuer is launching campaign with StartEngine		Travelmate Robotics Inc.	Corporation		NV	2016-07-08	CITY CENTRAL PLACE 400 S. 4TH STREET	SUITE 500	LAS VEGAS	NV	89101	https://travelmaterobotics.com	Wefunder Portal LLC	N	0001670254	007-00033	283503
0001665160-21-001430	1		Issuer is extending the campaign end date by 90 days.	Carnot Compression Inc.	Corporation		DE	2014-02-19	5610 SCOTTS VALLEY DRIVE, STE. B513	SUITE B513	SCOTTS VALLEY	CA	95066	https://carnotcompression.com/	StartEngine Capital, LLC	N	0001665160	007-00007	
0001665160-21-001429	1		Issuer is increasing Maximum Funding Amount	Full Circle Brewing Co. Ltd., LLC	Limited Liability Company		CA	1998-05-01	620 F Street		Fresno	CA	93706	fullcirclebrewing.com	StartEngine Capital, LLC	N	0001665160	007-00007	
0001873910-21-000002	0		Installing milestones in the investment	Vernafund CF LLC	Limited Liability Company		DE	2021-06-14	3767 ROCKDALE DR.		DALLAS	TX	75220	https://theapartmentqueen.investnext.com/portal/capital_raise/435/	MiTec, PBC	Y	0001690300	007-00133	292759
0001746059-21-000397	1		Issuer is extending the deadline to make an investment.	RANGOON RESTAURANT CONCEPTS LLC	Limited Liability Company		NY	2018-02-13	500 PROSPECT PL		BROOKLYN	NY	11238	https://www.rangoon.nyc/	MainVest, Inc.	N	0001746059	007-00162	
0001669191-21-000799	0		issuer updated the other material information section.	Brain Game LS Inc.	Corporation		NY	2014-10-15	1504 Bay Road	Suite 703	Miami Beach	FL	33139	https://finlitx.com/	NetCapital Funding Portal Inc.	N	0001669191	007-00035	283596
0001862162-21-000003	0		Voting power was entered incorrectly for one member as voting power should be proportional to shares owned.	GapNurse, Inc.	Corporation		WY	2019-10-01	9888 W. BELLEVIEW AVE	SUITE 2080	LITTLETON	CO	80123	https://gapnurse.com	PicMii Crowdfunding LLC	N	0001817013	007-00246	310171
0001669191-21-000796	0			Unum Health USA, Inc.	Corporation		DE	2021-04-16	651 N Broad St	Suite 206	Middletown	DE	19709	https://unumhealth.com	NetCapital Funding Portal Inc.	N	0001669191	007-00035	283596
0001837091-21-000001	0			Collective Convenience, Inc.	Corporation		DE	2019-04-24	251 Little Falls Drive		Wilmington	DE	19808	cxcohio.com	ARCVIEW CAPITAL, LLC	N	0001792363	008-70439	000306029
0001716822-21-000010	0	The Offering closed successfully on 8/06/2021, having received investment commitments of 90,040.00, although a final accounting has not taken place.		70 Million Resources, Inc.	Corporation		DE	2016-08-10	145 S. FAIRFAX AVENUE, 200		LOS ANGELES	CA	90036	www.commissary.club	OpenDeal Portal LLC	N	0001751525	007-00167	283874
0001669191-21-000792	0		the issuer updated the funding history section of the application.	Northstar Technologies Group, Inc.	Corporation		FL	2020-05-18	365 5th Avenue S	Suite 219	Naples	FL	34102	www.northstartgi.com	NetCapital Funding Portal Inc.	N	0001669191	007-00035	283596
0001716822-21-000009	0	The Offering closed successfully on 8/10/2021, having received investment commitments of $703,562.46, although a final accounting has not taken place.		AVY Entertainment, Inc.	Corporation		CA	2018-05-09	6020 LIDO LN		LONG BEACH	CA	90803	https://tempostorm.com	OpenDeal Portal LLC	N	0001751525	007-00167	283874
0001837254-21-000007	1		This Amendment is filed to make the following material change: raise the maximum offering amount from $1,070,000.00 to $5,000,000.00.	HT Naturals Inc.	Corporation		DE	2020-11-19	8605 Santa Monica Blvd		West Hollywood	CA	90069	http://www.hemptownusa.com	Title3Funds.com	N	0001685995	007-00083	286035
0001665160-21-001427	0	Adjustment to the initial Form C-U filing of 07/09/2021. At the close of the offering, the issuer closed on $73,206 and 41,641 number of securities.		Marshmallow Jetpack Inc.	Corporation		DE	2021-04-06	39848 SAN FRANCISQUITO CANYON ROAD		SANTA CLARITA	CA	91390	https://www.marshmallowjetpack.com	StartEngine Capital, LLC	N	0001665160	007-00007	
